<?xml version="1.0" encoding="UTF-8" standalone="no"?>
<!DOCTYPE karte SYSTEM "xml/karte.dtd">
<karte>
  <spieler>
    <name>1</name>
    <id>$5$saltycrackers!!!$G96bES5QKtnhvFAy3pZFHstKMo312JsT.uSn/PoDUG.</id>
    <zeitstempel>1465756822</zeitstempel>
  </spieler>
  <ressourcen><ressource id="1">12</ressource><ressource id="2">0</ressource><ressource id="3">29</ressource><ressource id="7">2001</ressource></ressourcen>
  <reihe>
    <feld>2</feld>
    <feld>2</feld>
    <feld>2</feld>
    <feld>2</feld>
    <feld>2</feld>
    <feld>1</feld>
    <feld>2</feld>
  </reihe>
  <reihe>
    <feld>2</feld>
    <feld>9</feld>
    <feld>2</feld>
    <feld>2</feld>
    <feld>2</feld>
    <feld>2</feld>
    <feld>2</feld>
  </reihe>
  <reihe>
    <feld>2</feld>
    <feld>3</feld>
    <feld>2</feld>
    <feld>2</feld>
    <feld>2</feld>
    <feld>2</feld>
    <feld>3</feld>
  </reihe>
  <reihe>
    <feld>3</feld>
    <feld>2</feld>
    <feld>2</feld>
    <feld>2</feld>
    <feld>2</feld>
    <feld>2</feld>
    <feld>2</feld>
  </reihe>
  <reihe>
    <feld>2</feld>
    <feld>2</feld>
    <feld>4</feld>
    <feld>2</feld>
    <feld>2</feld>
    <feld>2</feld>
    <feld>2</feld>
  </reihe>
  <reihe>
    <feld>2</feld>
    <feld>4</feld>
    <feld>2</feld>
    <feld>2</feld>
    <feld>7</feld>
    <feld>2</feld>
    <feld>2</feld>
  </reihe>
  <reihe>
    <feld>5</feld>
    <feld>2</feld>
    <feld>2</feld>
    <feld>2</feld>
    <feld>5</feld>
    <feld>2</feld>
    <feld>5</feld>
  </reihe>
</karte>
