<?xml version="1.0" encoding="UTF-8" standalone="no"?>
<!DOCTYPE karte SYSTEM "xml/karte.dtd">
<karte>
  <spieler>
    <name>user</name>
    <id>$5$saltycrackers!!!$3tll3erlIiRcXCq3UIx8HDvnjKaQEoPZvKwoG9LxB35</id>
    <zeitstempel>1465916952</zeitstempel>
  </spieler>
  <ressourcen><ressource id="1">1</ressource><ressource id="2">1</ressource><ressource id="3">1</ressource><ressource id="7">1</ressource></ressourcen>
  <reihe>
    <feld>2</feld>
    <feld>2</feld>
    <feld>2</feld>
    <feld>2</feld>
    <feld>2</feld>
    <feld>2</feld>
    <feld>2</feld>
  </reihe>
  <reihe>
    <feld>2</feld>
    <feld>2</feld>
    <feld>2</feld>
    <feld>2</feld>
    <feld>2</feld>
    <feld>2</feld>
    <feld>2</feld>
  </reihe>
  <reihe>
    <feld>1</feld>
    <feld>2</feld>
    <feld>2</feld>
    <feld>2</feld>
    <feld>2</feld>
    <feld>3</feld>
    <feld>3</feld>
  </reihe>
  <reihe>
    <feld>2</feld>
    <feld>2</feld>
    <feld>3</feld>
    <feld>2</feld>
    <feld>4</feld>
    <feld>2</feld>
    <feld>2</feld>
  </reihe>
  <reihe>
    <feld>2</feld>
    <feld>4</feld>
    <feld>2</feld>
    <feld>4</feld>
    <feld>2</feld>
    <feld>5</feld>
    <feld>5</feld>
  </reihe>
  <reihe>
    <feld>2</feld>
    <feld>2</feld>
    <feld>5</feld>
    <feld>2</feld>
    <feld>5</feld>
    <feld>2</feld>
    <feld>2</feld>
  </reihe>
  <reihe>
    <feld>5</feld>
    <feld>2</feld>
    <feld>2</feld>
    <feld>2</feld>
    <feld>2</feld>
    <feld>5</feld>
    <feld>5</feld>
  </reihe>
</karte>
